Ticker,Date,Time,Headline
NVDA,Oct-10-25,10:48AM,Nvidia Corporation (NVDA) Rated as 'Overweight' at KeyBanc amid Booming Business
NVDA,Oct-10-25,10:44AM,Wall Street slips lower as US government shutdown drags on
NVDA,Oct-10-25,10:25AM,Will NVIDIA's Data Center Business Unit Keep Beating Sales Records?
NVDA,Oct-10-25,10:15AM,Prediction: Nvidia Will Hit New Highs Faster Than Anyone Expects
NVDA,Oct-10-25,10:00AM,Did Meta Platforms Just Say Checkmate to Nvidia?
NVDA,Oct-10-25,09:51AM,"Stock Market Today: Dow Rises Amid Results For Nvidia Chipmaker, Delta. Tesla Faces Probe (Live Coverage)"
NVDA,Oct-10-25,09:30AM,"Prediction: While Nvidia Leads, This Lesser-Known AI Stock Could Catch Up"
NVDA,Oct-10-25,09:26AM,Josh Brown Explains Why NVIDIA (NVDA) 'Still The Most Obvious' Stock to Play AI Trade
NVDA,Oct-10-25,09:24AM,"Intel's new chips, TSMC sales, Nvidia: Trending Tickers"
NVDA,Oct-10-25,09:10AM,"Stock Market News for Oct 9, 2025"
NVDA,Oct-10-25,09:01AM,Intel outlines details of first PC chip made on its new manufacturing tech
NVDA,Oct-10-25,09:00AM,Intel unveils Core Ultra series 3 chip in major test for ailing chipmaker
NVDA,Oct-10-25,09:00AM,"Intel pushes further into humanoid robotics with new chip, software"
NVDA,Oct-10-25,09:00AM,Intel's Next-Generation Chip to Enter 'High Volume' Production by End of Year
NVDA,Oct-10-25,09:00AM,Global A.I. Influenced Cybersecurity Market Size Projected to Reach $234 Billion By 2032
NVDA,Oct-10-25,08:54AM,"Zacks Investment Ideas feature highlights: Nvidia, Vertiv, Arista Networks and Oklo"
NVDA,Oct-10-25,08:46AM,Nvidia CEO Jensen Huang Confirms A Major Investment In Elon Musk's XAI
NVDA,Oct-10-25,08:38AM,NVDA: Nvidia Rises After U.S. Approves Billions In AI Chip Exports To UAE
NVDA,Oct-10-25,08:38AM,"Stock Market Today: Dow Wavers Amid Results For Nvidia Chipmaker, Delta. Tesla Faces Probe (Live Coverage)"
NVDA,Oct-10-25,08:32AM,Nvidia Stock Jumps Again. What TSMC Has to Do With It.
NVDA,Oct-10-25,08:14AM,Here's what the OpenAI-AMD deal says about Nvidia
NVDA,Oct-10-25,08:07AM,Mar Vista U.S. Quality Premier Strategy: NVIDIA (NVDA) Continues to Benefit from AI infrastructure Build-out
NVDA,Oct-10-25,08:00AM,Massive News for Marvell Investors: Wall Street Sees 47% Upside
NVDA,Oct-10-25,06:47AM,"AI Bubble? Jamie Dimon, Nvidia's Jensen Huang, Goldman Sachs Weigh In."
NVDA,Oct-10-25,06:38AM,Dow Jones Futures: Nvidia Chipmaker Taiwan Semi Sales Strong; Delta Air Earnings Beat
NVDA,Oct-10-25,06:15AM,What Are the 3 Top Artificial Intelligence (AI) Stocks to Buy Right Now?
NVDA,Oct-10-25,06:03AM,Analysis-Musk's record Tesla package will pay him tens of billions even if he misses most goals
NVDA,Oct-10-25,06:02AM,"Nvidia shares eye fresh record, and other early market movers"
NVDA,Oct-10-25,06:00AM,Why Wall Street Analysts Say Were Not in an AI Bubble Yet
NVDA,Oct-10-25,05:54AM,TSMC posts forecast-beating Q3 revenue surge on AI boom
NVDA,Oct-10-25,05:27AM,Can Nvidia's Market Cap Hit $10 Trillion by 2030?
TSLA,Today,05:38AM,Nvidia Stock Chases Record High to End a Good Week. What's Driving the Chip Maker.
TSLA,Oct-10-25,05:30AM,Retail Crowd Beats the S&P 500 as Soaring Trading Sparks Concern
TSLA,Oct-10-25,01:24AM,Asian shares are mostly lower following Wall Street's pause from its feverish rally
TSLA,Oct-09-25,09:39PM,Jim Cramer Makes Bold Statement About Tesla (TSLA) CEO Elon Musk
TSLA,Oct-10-25,07:31PM,Elon Musk May Still Reap Billions From Tesla's Trillion-Dollar Pay Package Even Without Meeting Goals: Report
TSLA,Oct-10-25,05:35PM,"Podcast: U.S. Stocks Decline, Gold Pulls Back From Rally"
TSLA,Oct-10-25,05:14PM,Tesla Self-Driving Technology Breaks Traffic Laws. Can the Feds Stop It?
TSLA,Oct-10-25,05:08PM,Freedom Capital Raises Tesla (TSLA) Price Target to $338 After Record Q3 Deliveries
TSLA,Oct-10-25,04:27PM,"These Stocks Moved the Most Today: Delta, PepsiCo, Tesla, Ferrari, Costco, Oklo, MP Materials, and More"
TSLA,Oct-10-25,04:23PM,"Stocks to Watch Thursday: PepsiCo, MP Materials, Tilray Brands, Nvidia"
TSLA,Oct-10-25,04:13PM,Tesla Stock Falls. The Safety of Its Full Self Driving Is Under Investigation.
TSLA,Oct-10-25,03:51PM,Was DOGE all for nothing? Here are the receipts
TSLA,Oct-10-25,03:28PM,AMD's 38% Surge Just Killed a 3x ETF--And Wall Street Still Wants More
TSLA,Oct-10-25,03:22PM,These AI stocks could be the next winners
TSLA,Oct-10-25,03:05PM,"Tesla Makes Money Selling Electric Vehicles, but 90% of Its Value Could Soon Come From This Instead"
TSLA,Oct-10-25,02:39PM,Tesla Faces Federal Probe Over Full Self-Driving Traffic Violations
TSLA,Oct-10-25,02:34PM,"These Stocks Are Moving the Most Today: Delta, PepsiCo, Tesla, Ferrari, Costco, Oklo, MP Materials, and More"
TSLA,Oct-10-25,01:50PM,"GM's Bolt Is Back, and Inexpensive. It's a Challenge for Tesla."
TSLA,Oct-10-25,01:26PM,"Delta stock pops, PepsiCo earnings beat, Tesla safety probe"
TSLA,Oct-10-25,12:19PM,"Top Stock Movers Now: Delta Air Lines, PepsiCo, Akero Therapeutics, and More"
TSLA,Oct-10-25,12:01PM,Stock Market Today: Dow Drops; Tesla Hit While Two Cybersecurity Stocks Eye Entries (Live Coverage)
TSLA,Oct-10-25,11:19AM,Tesla's Full Self-Driving is in U.S. regulator's sights. The stock is dropping.
TSLA,Oct-10-25,11:14AM,Tesla Stock Dips as U.S. Opens Major Probe Into Self-Driving Safety Risks
TSLA,Oct-10-25,10:58AM,"Ferrari plunges, Tesla safety probe, Serve Robotics & DoorDash team up"
TSLA,Oct-10-25,10:35AM,Tech stocks weigh on market
TSLA,Oct-10-25,10:34AM,Porsches Sliding Sales Deepen German Automotive Malaise
TSLA,Oct-10-25,10:02AM,"Stock Market Today: Dow Falls Amid Results For Nvidia Chipmaker, Delta. Tesla Faces Probe (Live Coverage)"
TSLA,Oct-10-25,09:51AM,"Stock Market Today: Dow Rises Amid Results For Nvidia Chipmaker, Delta. Tesla Faces Probe (Live Coverage)"
TSLA,Oct-10-25,09:39AM,Here's Why Tesla Stock Is a Buy Before Oct. 22
TSLA,Oct-10-25,09:33AM,Netflix Expected a KPop Rally. Elon Musk and Tariffs Got In the Way
TSLA,Oct-10-25,09:11AM,'Elon's in the Saddle' - Analyst Says Tesla (TSLA) Has Huge Upside Potential Because of This
TSLA,Oct-10-25,09:00AM,"Intel pushes further into humanoid robotics with new chip, software"
TSLA,Oct-10-25,08:46AM,Nvidia CEO Jensen Huang Confirms A Major Investment In Elon Musk's XAI
TSLA,Oct-10-25,08:38AM,"Stock Market Today: Dow Wavers Amid Results For Nvidia Chipmaker, Delta. Tesla Faces Probe (Live Coverage)"
TSLA,Oct-10-25,08:31AM,Elon Musk agrees to settle $128 million lawsuit from fired Twitter execs
TSLA,Oct-10-25,08:12AM,Teslas Full Self-Driving Faces Another Federal Safety Probe
TSLA,Oct-10-25,08:09AM,"Ferrari, Jefferies, Alibaba, Las Vegas Sands: Trending Stocks"
TSLA,Oct-10-25,08:00AM,Where Will Rivian Stock Be in 5 Years?
TSLA,Oct-10-25,07:46AM,Tesla faces NHTSA probe over FSD traffic violations
TSLA,Oct-10-25,07:19AM,Tesla Stock Is Down. There Is Another FSD Safety Investigation.
TSLA,Oct-10-25,06:30AM,Tesla's New Model Y Doesn't Solve 1 Major Problem
TSLA,Oct-10-25,06:03AM,Analysis-Musk's record Tesla package will pay him tens of billions even if he misses most goals
TSLA,Oct-10-25,06:02AM,"Nvidia shares eye fresh record, and other early market movers"
TSLA,Oct-10-25,05:27AM,Can Nvidia's Market Cap Hit $10 Trillion by 2030?
TSLA,Oct-10-25,04:37AM,Ferrari lifts the hood on EV tech in maiden electric car
TSLA,Oct-10-25,04:23AM,"Tesla Q3 Deliveries Smash Estimates, But Wall Street Wasn't Impressed. What Gives?"
TSLA,Oct-10-25,03:15AM,Tesla Inc. (TSLA): Analyst Notes Improved Q3 Delivery Performance
TSLA,Oct-10-25,03:10AM,Tesla's New Robotaxi-Ready Models Strengthen the Bull Case for the Stock
TSLA,Oct-10-25,12:09AM,Tesla simplifies EV lineup with 'Standard': a strategic pause before the next leap
TSLA,Oct-08-25,10:48PM,Speed vs. strategy: the diverging paths of Tesla and China's EV makers
TSLA,Oct-10-25,05:45PM,Tesla (TSLA) Outpaces Stock Market Gains: What You Should Know
TSLA,Oct-10-25,05:41PM,"Tesla Launches $39,990 Model Y To Keep Buyers Hooked"
TSLA,Oct-10-25,05:30PM,"Why Tesla's EV changes are 'iterative,' not 'disruptive'"
TSLA,Oct-10-25,04:52PM,Dow Jones Futures: Nvidia's Huang Spurs AI-Led Market To Highs; Tesla Has New Buy Point
TSLA,Oct-10-25,04:30PM,"These Stocks Moved the Most Today: Tesla, Oracle, Dell, Fair Isaac, Equifax, AST SpaceMobile, Freeport-McMoRan, and More"
TSLA,Oct-10-25,04:24PM,"Joby, Archer Aviation Stocks Drop. Teslas News Was Only About EVs."
TSLA,Oct-10-25,04:18PM,Tesla Stock Rose. Why Affordable Standard Models Arent Exciting Wall Street.
TSLA,Oct-10-25,04:08PM,Tesla is back in the black. Here's why Wall Street moved beyond disappointment with cheaper models.
TSLA,Oct-10-25,03:57PM,"Stock Market Today: Dow Fades, Nasdaq Leads Charge After Fed Minutes; Nvidia Rises (Live Coverage)"
TSLA,Oct-10-25,03:43PM,Trump's trade war could cost automakers around the world $30B
TSLA,Oct-10-25,02:58PM,"Tesla Unveils New Models for Under $40,000"
TSLA,Oct-10-25,02:51PM,Stock Market Today: Indexes Up As Fed Minutes Point To More Rate Cuts; Nvidia Hits Entry (Live Coverage)
TSLA,Oct-10-25,02:39PM,Is the Stock Market in an AI Bubble? Goldman Sachs Says No.
TSLA,Oct-10-25,02:32PM,"These Stocks Are Moving the Most Today: Tesla, Oracle, Dell, Fair Isaac, Equifax, AST SpaceMobile, Freeport-McMoRan, and More"
TSLA,Oct-10-25,01:49PM,"Stock Market Today: Dow Up As Fed Report Looms; Oracle, Tesla At Key Levels (Live Coverage)"
TSLA,Oct-10-25,01:11PM,"Dell leads S&P 500 gains, Nvidia CEO confirms xAI investment"
TSLA,Oct-10-25,12:54PM,"Tesla Launches Lower-Priced Model Y and Model 3, but Analysts Say Still Too Costly"
TSLA,Oct-10-25,12:33PM,Base Power raises $1B to deploy home batteries everywhere
TSLA,Oct-10-25,12:31PM,William Blair's Dorsheimer: Tesla's stock is more aligned with robotaxis & FSD than new models
TSLA,Oct-10-25,12:18PM,"NvidiaxAI boosts chip stocks, Equifax strikes back against FICO"
TSLA,Oct-10-25,12:17PM,Elon Musks cheaper new Teslas arent much of a bargain
TSLA,Oct-10-25,12:09PM,Automakers to take $30B tariff hit to profits: Moody's
TSLA,Oct-10-25,11:35AM,Tesla's base model launch 'doesn't help' against cooling EV sales
TSLA,Oct-10-25,11:19AM,Tesla's Cheaper Models Fail to Impress
TSLA,Oct-10-25,10:49AM,Is the Ford Explorer Still a Cornerstone of Ford's US Lineup?
TSLA,Oct-10-25,10:32AM,Can Apollo Go's Global Expansion Power Baidu's Next Growth Phase?
TSLA,Oct-10-25,10:06AM,"Elon Musk's xAI to raise $20B, & Nvidia is investing: Bloomberg"
TSLA,Oct-10-25,09:59AM,TSLA: Tesla Faces Sharp Sell-Off After Introducing Lower Cost Models
TSLA,Oct-10-25,09:54AM,Tesla Stock Wobbles. Why Affordable Standard Models Arent Exciting Wall Street.
TSLA,Oct-10-25,09:51AM,"Company News for Oct 8, 2025"
TSLA,Oct-10-25,09:37AM,Tesla's new 'cheaper' EVs cost more than tax-credited originals
TSLA,Oct-10-25,09:30AM,Nvidia CEO Jensen Huang: Want to be part of almost everything Elon Musk is involved in
TSLA,Oct-10-25,09:22AM,Tesla Stock Rises Slightly. Why Affordable 'Standard' Models Aren't Exciting Wall Street.
TSLA,Oct-10-25,09:12AM,"Tesla stock target raised at Stifel on FSD, Robotaxi progress"
TSLA,Oct-10-25,09:01AM,Lithium Americas: Why This 31% Rally Is More Than Just a Headline
TSLA,Oct-10-25,09:00AM,"Stocks making big moves yesterday: Tesla, Dollar Tree, Plug Power, Carriage Services, and Lucky Strike"
TSLA,Oct-10-25,08:58AM,"The Zacks Analyst Blog Tesla, UnitedHealth, Shopify and Waterstone Financial"
TSLA,Oct-10-25,08:55AM,Analyst Says End of EV Tax Credits Positive for Tesla (TSLA) Amid 'Catch-22' Of Competitors
TSLA,Oct-10-25,08:43AM,"Are Tesla's ""Affordable"" Models Truly Cheap and Can They Fuel Demand?"
TSLA,Oct-10-25,08:28AM,Stock Market Today: Dow Rises As Rocket Firms Soar; Nvidia-Musk Deal In Focus (Live Coverage)
TSLA,Oct-10-25,08:23AM,Bull of the Day: Bloom Energy (BE)
TSLA,Oct-10-25,08:18AM,5 Things to Know Before the Stock Market Opens
TSLA,Oct-10-25,08:11AM,"Trending Tickers: Tesla, Intel, Confluent"
TSLA,Oct-10-25,07:49AM,Tesla Stock Rises. Why the Market Doesnt Care About a New Car.
TSLA,Oct-10-25,07:18AM,"Confluent shares surge on takeover talk, and other early movers"
TSLA,Oct-10-25,07:02AM,Tesla Stock Rises After New Model Reveal. Wall Street Is More Focused on This.
TSLA,Oct-10-25,06:26AM,"Tesla Shows Stock Valuations, Consumers Are Stretched. Here's the Silver Lining for Markets."
TSLA,Oct-10-25,06:09AM,Tesla's cheaper Model Y faces crowded field in Europe
TSLA,Oct-10-25,06:08AM,"UBS Raises Tesla (TSLA) Price Target to $247, Expects Focus on AI Outlook"
TSLA,Oct-10-25,06:00AM,Tesla's answer to a murky EV future: Shrinkflation
