Ticker,Date,Time,Headline
SPY,Today,06:20AM,Can the S&P 500 Continue Soaring Higher After a Strong Q3? Here's What History Says.
SPY,Oct-09-25,05:46PM,Party Rally Running Out of Fuel
SPY,Oct-10-25,02:46PM,The stock market keeps on giving - and investors aren't questioning a good thing
SPY,Oct-10-25,03:51AM,"If History Repeats, the No. 1 Exchange-Traded Fund (ETF) on Robinhood Can Make Investors Millionaires With a $100,000 Initial Investment and $625 Monthly Contributions Over 20 Years"
SPY,Oct-08-25,04:49AM,"The ETF Billionaires Love Right Now Could Soar Up to 124%, According to 1 Analyst"
SPY,Oct-07-25,06:13PM,Markets Take a Break from Setting New All-Time Highs
SPY,Oct-10-25,06:09PM,These Are the 3 Hottest Sectors for Q3 Earnings Growth
SPY,Oct-10-25,10:17AM,State Streets flagship S&P 500 ETF suffers record $32bn outflows
SPY,Oct-10-25,09:17AM,ThinkMarkets adds synthetic indices to its product offering
SPY,Oct-06-25,03:28PM,How to Defer Taxes Like the Rich and Famous
SPY,Oct-10-25,10:53AM,Why your S&P 500 index fund might be more risky than the internet bubble
SPY,Oct-10-25,09:23AM,"If You'd Invested $1,000 in the SPDR S&P 500 ETF Trust (SPY) 5 Years Ago, Here's How Much You'd Have Today"
SPY,Oct-03-25,10:16AM,No News Is Good News: Pre-markets Up on Dormant BLS Report
SPY,Oct-10-25,09:50AM,"Stock Market Today: Dow Rises As Jobs Report Nixed; Nvidia, Tesla Gain Ground (Live Coverage)"
SPY,Oct-10-25,09:44AM,Match-Trader Launches Trading Beyond Limits Global Campaign and Manifesto
SPY,Oct-10-25,07:50AM,'Debaser Trade' in Full Force as Bitcoin and Gold ETFs Rank in Top 10 for Volume
SPY,Oct-10-25,06:38AM,Time for Emerging Markets ETFs?
SPY,Oct-02-25,03:44PM,The stock market isn't letting a government shutdown spoil its party - so far
SPY,Oct-10-25,10:05AM,"Buy, Hold and Build Wealth: ETFs for Long-Term Investors"
SPY,Oct-10-25,09:46AM,Stock Market Today: Dow Falls As Jobless Data Gets The Ax; Tesla Jumps On Strong Deliveries (Live Coverage)
SPY,Oct-10-25,07:05AM,Codego Launches Whitelabel Devices Bringing Tokens Into Daily Life
SPY,Oct-10-25,07:00AM,B2BROKER Taps Finery Markets to Power Institutional Crypto OTC on B2TRADER
SPY,Oct-10-25,01:01AM,SPY and Jobs- What's Next for the Stock and Labor Markets
SPY,Oct-01-25,02:36PM,Dubai at the Centre of Global Finance: Forex Expo 2025 Redefines the Trading Landscape
SPY,Oct-10-25,10:14AM,ADP Sees Negative -32K Jobs in September
SPY,Oct-10-25,10:00AM,Growth & Large-Cap ETFs Worth Considering to Power Your Portfolio
SPY,Oct-10-25,09:48AM,"Stock Market Today: Dow Wavers On Shutdown, Jobs Report; Astera, Netflix, Nvidia, Tesla Drop (Live Coverage)"
SPY,Oct-10-25,08:41AM,"Stock Market Today: Dow Falls On Shutdown, Surprise Jobs Data; Astera, Nvidia, Tesla Drop (Live Coverage)"
SPY,Sep-30-25,06:24PM,More Record Closing Highs as Fed Government May Be Closing
SPY,Oct-10-25,09:56AM,Stock Market Today: Dow Falls Amid Economic Data; CoreWeave Jumps; Nvidia Extends Gains (Live Coverage)
SPY,Oct-10-25,06:30AM,"Is Investing $50,000 in the Stock Market Today Enough to Grow Your Portfolio to More Than $1 Million by Retirement?"
SPY,Oct-10-25,05:37AM,Edgen Launches MultiAgent Intelligence Upgrade to Unify Crypto and Equity Analysis
SPY,Sep-29-25,03:30PM,Mutuum Finance Surpasses $16.5M in Presale Amidst September Market Volatility
SPY,Oct-10-25,03:26PM,Ethereum-Based DeFi Crypto Mutuum Finance (MUTM) Reaches 50% Completion in Phase 6
SPY,Oct-10-25,09:53AM,"Stock Market Today: Dow Wobbles Ahead Of Jobs Report; Nvidia, Palantir, Tesla Rally (Live Coverage)"
SPY,Oct-10-25,09:21AM,"Stock Market Today: Dow Up Ahead Of Jobs Report; Nvidia, Tesla Rally (Live Coverage)"
SPY,Oct-10-25,07:00AM,Small-Cap Wins in Q3: Top-Performing ETFs in Focus
SPY,Sep-28-25,06:11AM,"If I Could Buy Only 1 High-Yield Dividend ETF for Passive Income in September, This Would Be It"
SPY,Sep-27-25,08:00AM,Even smaller tech stocks are getting expensive. But these sectors could be your next big win.
SPY,Sep-26-25,02:34PM,LYS Labs Moves Beyond Data and Aims to Become the Operating System for Automated Global Finance
SPY,Oct-10-25,02:03PM,Dexari Unveils $1M Cash Prize Trading Competition
SPY,Oct-10-25,01:37PM,Why Roth IRAs and Roth conversions may not make sense for you
SPY,Oct-10-25,10:30AM,"Market Minute 9-26-25- New Tariffs Coming for Trucks, Drugs, and...Cabinets"
SPY,Oct-10-25,10:18AM,PCE Delivers Goldilocks Numbers for the Stock Market
SPY,Oct-10-25,09:48AM,"Stock Market Today: Dow Rallies On Fed Inflation Data; Apple, Costco Fall (Live Coverage)"
SPY,Oct-10-25,09:09AM,Stock Market Today: Dow Rises On Fed Inflation Data; Apple Slides (Live Coverage)
SPY,Oct-10-25,05:12AM,"Here's How Much a $20,000 Investment in the S&P 500 Could Be Worth in 20 Years"
SPY,Sep-25-25,06:20PM,"Market Indexes Stay Lower 2nd Straight Day, PCE On Deck"
SPY,Oct-10-25,05:15PM,"KuCoin Appeals FINTRAC Decision, Reaffirms Commitment to Compliance"
SPY,Oct-10-25,03:49PM,The market's new big worry has nothing to do with stocks - and that's the problem
SPY,Oct-10-25,02:35PM,Forex Expo Dubai 2025 Conference to Feature 150+ Global FX and Fintech Leaders
SPY,Oct-10-25,02:23PM,Phase 6 Reaches 50% Mark as Mutuum Finance (MUTM) Approaches Next Price Step
SPY,Oct-10-25,11:01AM,"Stock Market Today: Dow, Nasdaq Pare Early Losses; Oklo Stock Thrashed (Live Coverage)"
SPY,Oct-10-25,10:32AM,"Econ Data Surprisingly Good: Jobless Claims, Q2 GDP, Durable Goods & More"
SPY,Oct-10-25,09:55AM,"Stock Market Today: Dow Falls After Surprise GDP, Jobless Claims; Nvidia, Oracle Sell Off (Live Coverage)"
SPY,Oct-10-25,06:52AM,4 Top-Performing ETF Areas of First Nine Months of 2025
SPY,Sep-24-25,03:15PM,Mutuum Finance (MUTM) Approaches Next Phase With 14.3% Price Increase After Raising $16 Million
SPY,Oct-10-25,03:00PM,Charting Whats Next as SPY Tests Our Top Technical Analysts V-Shaped Recovery Target
SPY,Oct-10-25,09:55AM,Stock Market Today: Dow Up Ahead Of Home Data; AI Stock Falls On Earnings (Live Coverage)
SPY,Sep-23-25,03:12PM,Is the diversified portfolio dead? The AI boom has turned an age-old investing rule on its head.
SPY,Oct-10-25,02:08PM,Is Now the Time to Buy Small-Cap Stocks?
SPY,Oct-10-25,09:45AM,Stock Market Today: Dow Up Ahead Of Powell Speech; Nvidia At Buy Point (Live Coverage)
SPY,Oct-10-25,06:00AM,Fed Signals More Easing: Can S&P 500 ETFs Rally Further?
SPY,Sep-22-25,01:12PM,Login Process Update: What You Need to Know
SPY,Oct-10-25,09:44AM,"Stock Market Today: Dow Falls Ahead Of Inflation Data; Apple, Tesla Up On Target Hikes (Live Coverage)"
SPY,Oct-10-25,08:00AM,Your Bourse and B2BROKER Partner to Deliver Complete Brokerage Solutions
SPY,Sep-21-25,09:45AM,Is Having a Position in the Entire Stock Market a Better Option Than Investing in the S&P 500?
SPY,Sep-20-25,10:18AM,10 bargain stocks of companies that can increase profits faster than the S&P 500
SPY,Sep-19-25,12:32PM,Stocks Rally Produces an Undefeated Buy Signal
SPY,Oct-10-25,11:33AM,Hola Prime Expands Its Platform Ecosystem with Next-Gen Tradelocker
SPY,Oct-10-25,10:36AM,"A Late Summer Reflection on Growth, Inflation & Jobs"
SPY,Oct-10-25,09:53AM,Stock Market Today: Dow Ticks Up During Trump-Xi Call; Tesla Upgraded (Live Coverage)
SPY,Oct-10-25,08:51AM,Stock Market Today: Dow Edges Higher During Trump-Xi Call; Tesla Upgraded (Live Coverage)
SPY,Sep-18-25,02:16PM,The Fed Cut Rates: What Now for the S&P 500 and Equity Markets?
SPY,Oct-10-25,09:48AM,"Stock Market Today: Dow Falls In Mixed Action After Rate Cut, Jobless Data; Nvidia Jumps On Intel Stake (Live Coverage)"
SPY,Oct-10-25,08:38AM,"Stock Market Today: Dow Rallies After Rate Change, Surprise Jobless Claims; Nvidia Surges On Intel Stake (Live Coverage)"
SPY,Oct-10-25,04:13AM,Want $1 Million in Retirement? 3 Simple Index Funds to Buy and Hold for Decades.
SPY,Sep-17-25,09:39PM,Direxion Appoints Jessica Fernandez as Global Chief Marketing Officer
SPY,Oct-10-25,06:30PM,"Fed Sees ""Two-Sided Risk"" in Lowering Interest Rates"
SPY,Oct-10-25,04:33PM,The Side of Rate Cuts Nobody Is Telling You About
SPY,Oct-10-25,04:29PM,"Investors Retreat From International, Turn to U.S. Equities Ahead of Rate Cut"
SPY,Oct-10-25,03:26PM,Forex Expo Dubai 2025 Returns October 67 With Exclusive Prize Draw Including Jetour X70 FL
SPY,Oct-10-25,01:32PM,Blueberry Launches a Bold New Brand Platform
SPY,Oct-10-25,10:30AM,Housing Numbers Down Ahead of Fed Rate Cut Today
SPY,Oct-10-25,09:45AM,Stock Market Today: Dow Climbs Ahead Of Fed Vote; Nvidia Slides On China Ban (Live Coverage)
SPY,Oct-10-25,05:45AM,"1 No-Brainer S&P 500 Index Fund to Buy Right Now for Less Than $1,000"
SPY,Oct-10-25,04:29AM,"XFunded Expands in Dubai, Strengthening Collaborations With Trading Influencers Across Europe"
SPY,Sep-16-25,04:28PM,"Investors Bet Big on U.S. Equities, Bonds"
SPY,Oct-10-25,02:16PM,New Cryptocurrency Mutuum Finance (MUTM) Raises $15.8M as Phase 6 Reaches 40%
SPY,Oct-10-25,02:04PM,Kintsu Launches sHYPE on Hyperliquid
SPY,Oct-10-25,02:01PM,"Leverage Shares Launches First 3x Single-Stock ETPs on HOOD, HIMS, UNH and Others"
SPY,Oct-10-25,10:57AM,"Stock Market Today: Dow Sinks, Nasdaq Wavers; Rocket Stock Crashes As Meta Does This (Live Coverage)"
SPY,Oct-10-25,10:36AM,Alchemy Markets Launches TradingView Integration for Direct Chart-Based Trading
SPY,Oct-10-25,10:28AM,"Retail Sales, Imports & Exports Warmer Ahead of Fed Meeting"
SPY,Oct-10-25,09:56AM,Stock Market Today: Dow Falls Amid Surprise Retail Sales; Dave & Busters Plunges (Live Coverage)
SPY,Sep-15-25,05:15PM,ETF Education: What Are Authorized Participants?
SPY,Oct-10-25,02:18PM,11 fast-growing small-cap stocks that could get a boost from the Fed's next move
SPY,Oct-10-25,01:00PM,Wiener Bank SE Partners with REAL Finance to Revolutionize Asset Management with Blockchain Technology
SPY,Oct-10-25,10:39AM,"Stock Market Today: Dow, Nasdaq Gain Amid Trump-China Talks; Tesla Surges On Musk Buy (Live Coverage)"
SPY,Oct-10-25,10:16AM,Moving Pieces Ahead of Fed Rate Decision
AAPL,Today,05:30AM,Retail Crowd Beats the S&P 500 as Soaring Trading Sparks Concern
AAPL,Oct-10-25,05:20AM,Warren Buffett's AI Bets: 24% of Berkshire Hathaway's $304 Billion Stock Portfolio Is Held in These 2 Artificial Intelligence (AI) Growth Stocks
AAPL,Oct-10-25,04:55AM,5 Monster Stocks to Hold for the Next 20 Years
AAPL,Oct-10-25,03:35AM,Prediction: These 4 Artificial Intelligence (AI) Stocks Will Be Worth More Than $7 Trillion by 2030
AAPL,Oct-10-25,02:30AM,"Bubble or Not, the AI Spending Binge Is Unprecedented in Every Way"
AAPL,Oct-09-25,05:45PM,Apple (AAPL) Declines More Than Market: Some Information for Investors
AAPL,Oct-10-25,04:31PM,Former Northrop Grumman CEO Ronald Sugar And Ex-CIA Venture Chief Gilman Louie Join Ursa Major Board To Scale Hypersonic Defense Tech
AAPL,Oct-10-25,02:40PM,Alphabet Unveils Gemini Enterprise AI for Business Clients
AAPL,Oct-10-25,12:04PM,"MP Gains 135% Post Securing U.S. Govt. Backing: Buy, Hold or Sell?"
AAPL,Oct-10-25,11:55AM,What Do Charts Say About the Dow? 3 Favorite Stocks That Could Lead a Year-End Push
AAPL,Oct-10-25,10:35AM,Tech stocks weigh on market
AAPL,Oct-10-25,10:00AM,Why Citi believes blockchain is here to stay on Wall Street
AAPL,Oct-10-25,09:15AM,"Company News for Oct 9, 2025"
AAPL,Oct-10-25,09:00AM,Intel unveils Core Ultra series 3 chip in major test for ailing chipmaker
AAPL,Oct-10-25,09:00AM,Inside Intels big bet to save US chipmaking  and itself
AAPL,Oct-10-25,08:40AM,China Blacklists Researcher That Exposed Huawei Chip Secrets
AAPL,Oct-10-25,08:03AM,"Apple Harvests Demand - And Picks This Fight With Meta, Google"
AAPL,Oct-10-25,07:44AM,Apple (AAPL) Rebounded as Investors' Concerns Eased
AAPL,Oct-10-25,06:03AM,Analysis-Musk's record Tesla package will pay him tens of billions even if he misses most goals
AAPL,Oct-10-25,05:54AM,TSMC posts forecast-beating Q3 revenue surge on AI boom
AAPL,Oct-10-25,03:04AM,China Widens Rare Earth Curbs Ahead of Critical Xi-Trump Meeting
AAPL,Oct-10-25,12:56AM,OpenAI's Sora app tops iPhone downloads amid deepfake concerns and revised usage policies
AAPL,Oct-08-25,11:29PM,"OpenAI's DevDay Keynote, Where My Skepticism Is Found, Jony Ive's Fireside Chat at DevDay"
AAPL,Oct-10-25,04:19PM,Here Are the 12 Best Buyback Aristocrat Stocks
AAPL,Oct-10-25,04:19PM,Here Are the 12 Best 'Buyback Aristocrats'
AAPL,Oct-10-25,03:38PM,"Google Wants Right to Bundle Gemini AI App With Maps, YouTube"
AAPL,Oct-10-25,02:39PM,Is the Stock Market in an AI Bubble? Goldman Sachs Says No.
AAPL,Oct-10-25,01:33PM,Should You Buy Apple Stock Before Oct. 30?
AAPL,Oct-10-25,10:35AM,Stock Market Today: Dow Higher As Fed Report Looms; Nvidia Rises Amid Musk Deal (Live Coverage)
AAPL,Oct-10-25,09:12AM,Intel cut at HSBC as analysts question sustainability of deal-driven rally
AAPL,Oct-10-25,09:03AM,"Goldman Sachs strategist: No stock market bubble, yet"
AAPL,Oct-10-25,08:59AM,Analyst Says Apple (AAPL) Is Going to Make a New All-Time High
AAPL,Oct-10-25,08:30AM,Zino: Apple must get the AI story right to drive the next upgrade cycle
AAPL,Oct-10-25,06:13AM,Amkor expands Arizona semiconductor campus investment to $7B
AAPL,Oct-10-25,06:04AM,JPMorgan Stays Bullish on Apple (AAPL) with Stable iPhone 17 Lead Times
AAPL,Oct-10-25,05:34AM,Jim Cramer Says Long-Term Apple Holders Are Winners
AAPL,Oct-07-25,01:30PM,Apple's Headset Strategy and Tesla's EV Sales Windfall
AAPL,Oct-10-25,11:32AM,Strategy Ranks Among Top Five U.S. Corporate Treasuries With $80B in Bitcoin Holdings
AAPL,Oct-10-25,10:05AM,"At $1.2 Trillion, More High-Grade Debt Now Tied to AI Than Banks"
AAPL,Oct-10-25,09:00AM,Qualcomm to acquire Arduino amid edge computing push
AAPL,Oct-10-25,08:59AM,"Analyst Says Apple's (AAPL) Valuation Reflects ""Overly Bullish"" iPhone Outlook"
AAPL,Oct-10-25,08:51AM,Why Jim Cramer thinks the stock market isn't loved
AAPL,Oct-10-25,08:00AM,"Tech Weekly: Massive chip deals, Meta's AI chats"
AAPL,Oct-10-25,06:25AM,CNBC Changemakers and Power Players: How Laura Modi took on the baby formula industry and won big
AAPL,Oct-10-25,06:00AM,"Kentucky Governor Grapples With Tariffs, Says 2028 Call Can Wait"
AAPL,Oct-06-25,11:52PM,"EA Sells to Private Equity, Gaming Industry Continues to Change, Anthropic's NYC Pop-up Shop"
AAPL,Oct-10-25,09:55PM,Largan sees September revenue surge from iPhone 17; 3Q25 earnings call set for Oct 9
AAPL,Oct-10-25,07:08PM,Google's Play Store shake-up looms after Supreme Court refuses to delay overhaul of the monopoly
AAPL,Oct-10-25,04:24PM,"Yes, AirPods Are Still Being Underestimated (AVALON Podcast)"
AAPL,Oct-10-25,04:06PM,The Third Quarter Was Tranquil. The Fourth Might Not Be.
AAPL,Oct-10-25,03:04PM,Apple Supplier Foxconn Sees AI Server Demand Lifting Q4 Growth
AAPL,Oct-10-25,02:44PM,MicroStrategy Didn't Buy Bitcoin Last Week. The Stock Is Gaining.
AAPL,Oct-10-25,02:31PM,Qualcomm fights $647 million UK lawsuit over smartphone chip royalties
AAPL,Oct-10-25,12:39PM,Wall Street analyst sees Bitcoin hitting new highs despite U.S. shutdown
AAPL,Oct-10-25,10:53AM,Why your S&P 500 index fund might be more risky than the internet bubble
AAPL,Oct-10-25,09:19AM,Jim Cramer: Nvidia's next act will be bigger than gaming or AI
AAPL,Oct-10-25,08:47AM,AAPL: Apple Faces 13% Value Loss After Failing To Lift iPhone Prices
AAPL,Oct-10-25,08:30AM,Here's How Much a $1000 Investment in Apple Made 10 Years Ago Would Be Worth Today
AAPL,Oct-10-25,07:50AM,Nvidia Stock Drops. Why OpenAI's New Deal Is Bad News for the Chip Leader.
AAPL,Oct-10-25,07:47AM,A new era of financial service: The convergence of banking and telecom
AAPL,Oct-10-25,07:19AM,Nvidia Stock Rises. Sales From This Key Supplier Signals Strong AI Demand.
AAPL,Oct-10-25,07:00AM,Nasdaq Has Become the Market of Choice for Dubious Penny-Stock IPOs
AAPL,Oct-10-25,07:00AM,5 Dividend Stocks to Hold for the Next 25 Years
AAPL,Oct-10-25,05:48AM,Multicoin Exec Says GENIUS Act Will End Banks Rip-Off of Retail Depositors with Low Rates
AAPL,Oct-10-25,05:45AM,"5 Unstoppable ""Magnificent Seven"" Stocks to Buy in October"
AAPL,Oct-10-25,04:33AM,OpenAI Announcements Make Waves in Stock Market It Has Shunned
AAPL,Oct-05-25,09:45PM,"The Best Warren Buffett Stocks to Buy with $1,000 Right Now"
AAPL,Oct-10-25,09:23PM,Bitcoin Hits $125k All-Time High: 9 Must-See Charts
AAPL,Oct-10-25,08:47PM,India roundup: Number of Apple suppliers in India likely reaches 45
AAPL,Oct-10-25,03:45PM,Apple Gears Up for Executive Shake-Up  Here's Who's in the Succession Spotlight
AAPL,Oct-10-25,01:54PM,"Let's Talk About Bloomberg's Vision Pro Hit Piece, Revisiting Apple's Spatial Computing Strategy"
AAPL,Oct-10-25,01:51PM,"Amazon Unveils New Hardware, A Few Alexa+ Product Highlights, Search Party"
AAPL,Oct-10-25,01:47PM,"Meta Launches Vibes, OpenAI Launches Sora 2, Sora as a Social App?"
AAPL,Oct-10-25,01:41PM,Why Is MP Materials Stock Sliding Right Now?
AAPL,Oct-10-25,09:30AM,"Wall Street, crypto industry say tokenization will reshape global markets: 'Its going to eat the entire financial system'"
AAPL,Oct-10-25,05:16AM,33.5% of Warren Buffett's $304 Billion Portfolio Is Invested in 4 Artificial Intelligence (AI) Stocks
AAPL,Oct-10-25,04:38AM,Street Calls of the Week
AAPL,Oct-10-25,03:52AM,Nvidia Partner Hon Hai Meets Sales Estimates on Strong AI Demand
AAPL,Oct-10-25,03:37AM,"Foxconn third-quarter revenue hits record, misses market forecast"
AAPL,Oct-10-25,02:42AM,Apple Inc. (AAPL) Sued Over Workplace Discrimination
AAPL,Oct-04-25,01:32PM,"If You Invested $10,000 in Apple Stock 10 Years Ago, Here's How Much You'd Have Today"
AAPL,Oct-10-25,07:57AM,Apple or Super Micro Computer: Bernstein Selects the Top AI Hardware Stock to Buy
AAPL,Oct-10-25,07:00AM,MarketBeat Week in Review - 09/29 - 10/03
AAPL,Oct-10-25,06:30AM,How carrier incentives allow iPhones to be more affordable
AAPL,Oct-10-25,01:01AM,Magnificent Seven surpass EU GDP: Is this a tech bubble warning?
AAPL,Oct-03-25,05:10PM,"Stocks to Watch Recap: Apple, Applied Materials, Chevron, Broadcom"
AAPL,Oct-10-25,04:24PM,"These Stocks Moved the Most Today: Tesla, Applied Materials, Apple, Plug Power, Wynn Resorts, Rumble, and More"
AAPL,Oct-10-25,04:22PM,"AMD not fabbing at Intel, says SemiAccurate; shares retreat"
AAPL,Oct-10-25,04:00PM,"Tech Industry Groups Push Back on Trumps $100,000 H-1B Visa Fee"
AAPL,Oct-10-25,03:25PM,"Big Tech ETF slumps, with just two of its holdings in positive territory"
AAPL,Oct-10-25,03:17PM,AAPL: Jefferies Downgrades Apple To 'Underperform' Citing Foldable iPhone Risks
AAPL,Oct-10-25,03:13PM,Apple Removes ICEBlock App After DOJ Raises Safety Fears
AAPL,Oct-10-25,02:47PM,Apple analyst unveils dire forecast after iPhone 17 launch
AAPL,Oct-10-25,02:42PM,"Samsung puts crypto in 75 million pockets, Apple refuses to play"
AAPL,Oct-10-25,02:07PM,Jeff Bezos Is the Latest Tech Executive to Talk About an AI 'Bubble.' Why He's Still Optimistic.
AAPL,Oct-10-25,01:57PM,The Magnificent Seven Stocks Are Roaring Again. Can They Keep Climbing?
AAPL,Oct-10-25,01:55PM,"Apple Bows to Washington Pressure, Removes ICE-Tracking Apps"
AAPL,Oct-10-25,01:51PM,"These Stocks Are Moving the Most Today: Tesla, Applied Materials, Apple, Plug Power, Wynn Resorts, Rumble, and More"
AAPL,Oct-10-25,01:10PM,Squawk Pod: A new AI browser & jobs Friday without jobs data - 10/03/25  Audio Only
AAPL,Oct-10-25,01:06PM,Jefferies Turns Bearish on Apple's iPhone Outlook
NVDA,Today,05:38AM,Nvidia Stock Chases Record High to End a Good Week. What's Driving the Chip Maker.
NVDA,Oct-10-25,06:00AM,Better AI Stock to Buy: CoreWeave or Nvidia?
NVDA,Oct-10-25,05:58AM,"These Stocks Are Moving the Most Today: Nvidia, Venture Global, Applied Digital, Levi Strauss, Elastic, and More"
NVDA,Oct-10-25,05:30AM,Retail Crowd Beats the S&P 500 as Soaring Trading Sparks Concern
NVDA,Oct-10-25,05:29AM,"Stocks to Watch Friday: Applied Digital, Venture Global, Levi Strauss"
NVDA,Oct-10-25,05:11AM,China tightens checks on Nvidia chips at major ports: FT
NVDA,Oct-10-25,05:10AM,Where Will Intel Stock Be in 1 Year?
NVDA,Oct-10-25,05:05AM,Is Rigetti Computing a Millionaire-Maker Stock?
NVDA,Oct-10-25,04:57AM,"Samsung Electronics Shares Hit Record High on AI, Chip Optimism"
NVDA,Oct-10-25,04:55AM,5 Monster Stocks to Hold for the Next 20 Years
NVDA,Oct-10-25,04:21AM,Asian markets limp into weekend as AI bubble fears grow
NVDA,Oct-10-25,04:03AM,Can Nvidia's Stock Still Be a 10-Bagger Investment in the Future?
NVDA,Oct-10-25,03:35AM,Prediction: These 4 Artificial Intelligence (AI) Stocks Will Be Worth More Than $7 Trillion by 2030
NVDA,Oct-10-25,02:30AM,"Bubble or Not, the AI Spending Binge Is Unprecedented in Every Way"
NVDA,Oct-10-25,02:13AM,"China tightens checks on Nvidia AI chips at major ports, FT reports"
NVDA,Oct-10-25,01:24AM,Asian shares are mostly lower following Wall Street's pause from its feverish rally
NVDA,Oct-10-25,12:10AM,"China steps up customs crackdown on Nvidia AI chips, FT reports"
NVDA,Oct-10-25,12:00AM,China launches customs crackdown on Nvidia AI chips
NVDA,Oct-09-25,11:05PM,TSMC and Samsung Offer Clues to Global AI Boom
NVDA,Oct-10-25,09:35PM,Jim Cramer Defends NVIDIA (NVDA) After AMD's OpenAI Deal
NVDA,Oct-10-25,09:31PM,CoreWeave Turns $50 Million Convertible Notes Into $12.5 Billion AI Jackpot For This Hedge Fund (CORRECTED)
NVDA,Oct-10-25,08:39PM,Trump Team Approves Nvidia Chip Sales for US Projects in UAE
NVDA,Oct-10-25,08:31PM,"Nvidia CEO Jensen Huang Says He's 'Surprised' AMD Would Give Away 10% Of The Company In Its Deal With OpenAI: 'It's Clever, I Guess'"
NVDA,Oct-10-25,07:53PM,"While OpenAI races to build AI data centers, Nadella reminds us that Microsoft already has them"
NVDA,Oct-10-25,06:13PM,"Nvidia, Microsoft, and OpenAI Have Investors Going in Circles. This Chart Shows How."
NVDA,Oct-10-25,05:26PM,Planet Labs is using AI & Nvidia chips to power new satellite images
NVDA,Oct-10-25,05:23PM,One of Nvidia's Biggest Customers Just Struck a Massive Deal That Should Alarm Shareholders
NVDA,Oct-10-25,05:15PM,"KeyBanc Reaffirms Buy on Nvidia Ahead of Earnings, Citing Strong AI Demand"
NVDA,Oct-10-25,04:40PM,"Stocks, Gold Pull Back as Shutdown Uncertainty Persists"
NVDA,Oct-10-25,04:31PM,Former Northrop Grumman CEO Ronald Sugar And Ex-CIA Venture Chief Gilman Louie Join Ursa Major Board To Scale Hypersonic Defense Tech
NVDA,Oct-10-25,04:27PM,Stocks Slide as Government Shutdown Heads To Day 10
NVDA,Oct-10-25,04:23PM,"Stocks to Watch Thursday: PepsiCo, MP Materials, Tilray Brands, Nvidia"
NVDA,Oct-10-25,04:18PM,"Stock Market Today: Russell 2000 Leads Pullback, Gold Stocks Fall Hard; Lesson From Ferrari's Plunge (Live Coverage)"
NVDA,Oct-10-25,04:16PM,Stock Market Today: Dow Falls 300 Points; Gold Miners Fall Hard As Silver Sinks 3% (Live Coverage)
NVDA,Oct-10-25,04:01PM,"Stock market today: Dow slides, S&P 500, Nasdaq retreat from records as rally takes another breather"
NVDA,Oct-10-25,03:41PM,Nvidia Just Won Big in the Gulf -- And China's Watching
NVDA,Oct-10-25,03:35PM,Nvidia CEO Jensen Huang on Trump's H-1B visa changes
NVDA,Oct-10-25,03:33PM,Intel's $5B AI Gambit: Can These Chips Dethrone Nvidia?
NVDA,Oct-10-25,03:30PM,Why UiPath Stock Surged (Again) This Week
NVDA,Oct-10-25,03:21PM,NVDA: Nvidia Stock Breaks New Record After Cantor Hikes Price Target to $300
NVDA,Oct-10-25,02:45PM,"It's 'early stages' of AI bubble, but don't sound the alarm just yet"
NVDA,Oct-10-25,02:31PM,"Nvidia CEO Jensen Huang Says Intel Spent 33 Years 'Trying To Kill Us' But Now Calls The Chip Rival A Partner: 'We're Lovers, Not Fighters'"
NVDA,Oct-10-25,02:14PM,Dell Technologies Up 32% in a Month: Should Investors Buy the Stock?
NVDA,Oct-10-25,02:01PM,"AI Party Is Not Over, Goldman Sachs Issues Top Picks"
NVDA,Oct-10-25,01:45PM,"Trump's Stock Market Grab: What It Means For Nvidia, Intel And The U.S. Economy"
NVDA,Oct-10-25,01:42PM,Nvidia-Backed AI Startup n8n Raises $180M at $2.5B Valuation
NVDA,Oct-10-25,01:40PM,"Stock Market Today: Stocks Dip Despite Strong PepsiCo, Delta Earnings"
NVDA,Oct-10-25,01:35PM,U.S. reportedly approves several billion dollars of Nvidia chip sales to UAE
NVDA,Oct-10-25,01:21PM,"Investors are questioning the AI trade today for these two reasons, says Zacks Investment Management"
NVDA,Oct-10-25,01:17PM,Would Investing in Nvidia Stock Have Been Better Than Playing the Lottery?
NVDA,Oct-10-25,01:15PM,Arm Holdings' Lofty Valuation Raises Short-Term Caution
NVDA,Oct-10-25,12:59PM,Why AMD Stock Is Soaring This Week
NVDA,Oct-10-25,12:56PM,Should You Buy Nvidia's Stock Right Now?
NVDA,Oct-10-25,12:50PM,Nvidia's CEO Shares His Thoughts About AMD and OpenAI's Recent Deal
NVDA,Oct-10-25,12:44PM,Nvidia Stock Spikes To Record High On UAE Trade Approval
NVDA,Oct-10-25,12:31PM,Nvidia Stock Could Get Another Boost After U.S. Approves UAE AI Chip Deal
NVDA,Oct-10-25,12:08PM,"Mortgage rates decline, UiPath gains on Nvidia, OpenAI partnership"
NVDA,Oct-10-25,12:06PM,Why Nvidia (NVDA) Stock Is Trading Up Today
NVDA,Oct-10-25,12:05PM,Can Nvidia reach $7 trillion? One of Wall Street's biggest bulls now thinks so.
NVDA,Oct-10-25,12:01PM,Stock Market Today: Dow Drops; Tesla Hit While Two Cybersecurity Stocks Eye Entries (Live Coverage)
NVDA,Oct-10-25,12:01PM,What bubble? NVIDIA stock is born to run as analyst sets $7 trillion target
NVDA,Oct-10-25,12:00PM,"Nasdaq Pulls Back After Breaking Above 23,000"
NVDA,Oct-10-25,11:55AM,What Do Charts Say About the Dow? 3 Favorite Stocks That Could Lead a Year-End Push.
NVDA,Oct-10-25,11:41AM,1 Unstoppable Semiconductor Stock to Buy Instead of AMD
NVDA,Oct-10-25,11:40AM,"Nvidia stock climbs amid reported UAE export approval, Wall Street price target raise: 'This is not a bubble'"
NVDA,Oct-10-25,11:36AM,Top AI Stocks You Should Buy to Rejuvenate Your Portfolio
NVDA,Oct-10-25,10:59AM,"Nvidia-backed Reflection AI raises $2 billion in funding, boosts valuation to $8 billion"
NVDA,Oct-10-25,10:58AM,"Jim Cramer on NVIDIA's CEO: ""Why the Heck Wouldn't I Believe Him"""
NVDA,Oct-10-25,10:54AM,Oracle Is the 'AI Juggernaut for the Information Age.' Why the Stock Isn't Acting Like It.
